{
  "schema_id": "asklegal.hk-regulatory.coverage-decision-report",
  "schema_version": "1.0.0",
  "rule_id": "HKREG-COVERAGE-DECISION-001",
  "case_id": "HKREG-DET-COV-011",
  "assertion_scope": "ORPHAN_OUTPUT",
  "observed_decision": {
    "schema_id": "asklegal.hk-regulatory.coverage-decision-result",
    "schema_version": "1.0.0",
    "rule_id": "HKREG-COVERAGE-DECISION-001",
    "case_id": "HKREG-DET-COV-011",
    "outcome": "INVALID",
    "reason": "ORPHANED_OUTPUT",
    "coverage_complete": false,
    "source_fidelity_valid": true,
    "source_order_valid": false,
    "board_ownership_valid": true,
    "dependency_accounting_valid": true,
    "total_source_unit_count": 8,
    "primary_owned_unit_count": 7,
    "non_serving_unit_count": 2,
    "board_results": [
      {
        "scope_id": "HK-REG-HKEX-GEM",
        "inventory_bounded": true,
        "coverage_complete": false,
        "required_current_unit_count": 3,
        "ready_current_unit_count": 3,
        "blocked_or_quarantined_unit_count": 0,
        "search_record_candidate_count": 1,
        "later_gate_candidate_ready": false
      },
      {
        "scope_id": "HK-REG-HKEX-MAIN-BOARD",
        "inventory_bounded": true,
        "coverage_complete": false,
        "required_current_unit_count": 3,
        "ready_current_unit_count": 3,
        "blocked_or_quarantined_unit_count": 0,
        "search_record_candidate_count": 1,
        "later_gate_candidate_ready": false
      }
    ],
    "violation_codes": [
      "ORPHAN_OUTPUT",
      "SOURCE_ORDER_CHANGED"
    ],
    "search_record_authorized": false,
    "embedding_authorized": false,
    "release_authorized": false,
    "serving_authorized": false,
    "deployment_authorized": false,
    "external_effects": "NONE"
  },
  "expected_decision": {
    "schema_id": "asklegal.hk-regulatory.coverage-decision-result",
    "schema_version": "1.0.0",
    "rule_id": "HKREG-COVERAGE-DECISION-001",
    "case_id": "HKREG-DET-COV-011",
    "outcome": "INVALID",
    "reason": "ORPHANED_OUTPUT",
    "coverage_complete": false,
    "source_fidelity_valid": true,
    "source_order_valid": false,
    "board_ownership_valid": true,
    "dependency_accounting_valid": true,
    "total_source_unit_count": 8,
    "primary_owned_unit_count": 7,
    "non_serving_unit_count": 2,
    "board_results": [
      {
        "scope_id": "HK-REG-HKEX-GEM",
        "inventory_bounded": true,
        "coverage_complete": false,
        "required_current_unit_count": 3,
        "ready_current_unit_count": 3,
        "blocked_or_quarantined_unit_count": 0,
        "search_record_candidate_count": 1,
        "later_gate_candidate_ready": false
      },
      {
        "scope_id": "HK-REG-HKEX-MAIN-BOARD",
        "inventory_bounded": true,
        "coverage_complete": false,
        "required_current_unit_count": 3,
        "ready_current_unit_count": 3,
        "blocked_or_quarantined_unit_count": 0,
        "search_record_candidate_count": 1,
        "later_gate_candidate_ready": false
      }
    ],
    "violation_codes": [
      "ORPHAN_OUTPUT",
      "SOURCE_ORDER_CHANGED"
    ],
    "search_record_authorized": false,
    "embedding_authorized": false,
    "release_authorized": false,
    "serving_authorized": false,
    "deployment_authorized": false,
    "external_effects": "NONE"
  },
  "conformance_status": "PASS",
  "source_authorized": false,
  "provider_authorized": false,
  "release_authorized": false,
  "serving_authorized": false,
  "deployment_authorized": false,
  "external_effects": "NONE"
}
